null,Middle East respiratory syndrome-related coronavirus,Severe acute respiratory syndrome coronavirus 2,Severe acute respiratory syndrome-related coronavirus,Human coronavirus HKU1,Human coronavirus OC43
Middle East respiratory syndrome-related coronavirus,100.00,64.32,64.23,50.53,51.08
Severe acute respiratory syndrome coronavirus 2,63.82,100.00,94.31,51.46,53.19
Severe acute respiratory syndrome-related coronavirus,65.66,94.31,100.00,52.84,52.20
Human coronavirus HKU1,54.22,54.14,55.65,100.00,77.26
Human coronavirus OC43,56.00,84.62,84.62,77.26,100.00