null,Human coronavirus OC43,Human coronavirus HKU1,Middle East respiratory syndrome-related coronavirus,Severe acute respiratory syndrome coronavirus 2,Severe acute respiratory syndrome-related coronavirus
Human coronavirus OC43,100.00,76.64,48.57,47.21,47.62
Human coronavirus HKU1,76.21,100.00,43.24,46.24,51.85
Middle East respiratory syndrome-related coronavirus,48.57,43.24,100.00,48.28,37.50
Severe acute respiratory syndrome coronavirus 2,47.21,46.24,48.28,100.00,86.84
Severe acute respiratory syndrome-related coronavirus,47.62,51.85,37.50,86.84,100.00